User,Text
@TheBTCTherapist,"#Bitcoin makes you immune to the time theft orchestrated by central banks all across the world.

Protect yourself from debasement."
@Brc20Bull,"After God rested on the 7th day, Satoshi Nakamoto forged #Bitcoin 4000 years later, then Bitoshi Blockamoto birthed BITMAP 14 years after that.

Something epic is brewing, and now is the time to watch as all the development takes BITMAP to new heights!  #Bitmap #BitmapEmporium"
@cryptochimpanz,"Daily reminder that we'll see significantly higher prices later this year.

Remember, the longer we're inside this re-accumulation, the faster we're at $100k.

#Bitcoin"
@Vivek4real_,"#Bitcoin held on exchanges is hitting all-time lows.

Supply shortage incoming"
@BTC_for_Freedom,There’s life before you understood #bitcoin and there’s life after it.
@imabearhunter,"Someone just moved $337M in #Bitcoin  across the planet for a $3 fee.  

Which one of you did that?"
@TheBTCTherapist,#Bitcoin vs the dollar
@pete_rizzo_,"Why Andreas Antonopoulos Is A #Bitcoin legend

Evangelized to empty rooms when $BTC was $100
Educated millions with his books and videos

A thread."
@CryptoTony__,"If #Bitcoin moves hard, be prepared to see #Altcoins drop again. This will be the next buy if it comes"
@TheDustyBC,Are you ready for another massive #Bitcoin move?
@Scavacini777,Can't ban #Bitcoin
@BitcoinMagazine,"NEW:  Ohio State commencement speaker talks #Bitcoin in front of 60,000 people and gets booed.

We are so early"
@cryptojack,"#Bitcoin is on track to hit $200,000 before year-end. Thumbs up if you agree!"
@BitcoinNewsCom,"NEW:  US government holds ~212,847 #Bitcoin as of April 2024."
@BTC_for_Freedom,There’s no hype for #bitcoin right now. Only billionaires and plebs are stacking.
@Traderbot21,#Bitcoin  Miners Balance
@SimplyBitcoinTV,JUST IN: SEC Chairman Gary Gensler gets called out on CNBC for not answering if ETH is a security then again dodges the question
@Kluckies_,#bitcoin is the way out of this bs
@BHVenture,"Tired of slow and expensive Bitcoin transactions? 
@bitfinitynet
 is here to change the game! This innovative Layer 2 solution acts like a high-speed highway for Bitcoin and other valuable assets, enabling faster, complex and more affordable transactions 

Built with…"
@BitcoinMagazine,"JUST IN:  South Korea’s winning party to allow spot #Bitcoin ETFs in the country soon: Reports

Asia is ready"
@GoodShepherd316,"Pope is not the way
Mary is not the way
Mohammed is not the way
Buddha is not the way
Confucius is not the way
Government is not the way
UN is not the way
Politicians are not the way
Riches are not the way
Bitcoin is not the way

JESUS CHRIST said,

“I AM the WAY.”"
